{
  "audit": {
    "clause_audits": [
      {
        "accepted": true,
        "clause": "C1_OBJECTHOOD",
        "errors": [],
        "hard_gate_passed": true,
        "scope_exact": true
      },
      {
        "accepted": true,
        "clause": "C2_STRICT_PROMOTION",
        "errors": [],
        "hard_gate_passed": true,
        "scope_exact": true
      },
      {
        "accepted": true,
        "clause": "C3_REFLEXIVE_SELF_COORDINATE",
        "errors": [],
        "hard_gate_passed": true,
        "scope_exact": true
      },
      {
        "accepted": true,
        "clause": "C4_INTERFACE_NONEXPOSURE",
        "errors": [],
        "hard_gate_passed": true,
        "scope_exact": true
      },
      {
        "accepted": true,
        "clause": "C5_ACTION_CREDIT",
        "errors": [],
        "hard_gate_passed": true,
        "scope_exact": true
      },
      {
        "accepted": true,
        "clause": "C6_TEMPORAL_CLOSURE",
        "errors": [],
        "hard_gate_passed": true,
        "scope_exact": true
      },
      {
        "accepted": true,
        "clause": "C7_BINDING_RECOMBINATION",
        "errors": [],
        "hard_gate_passed": true,
        "scope_exact": true
      },
      {
        "accepted": true,
        "clause": "C8_VIABILITY_REPAIR",
        "errors": [],
        "hard_gate_passed": true,
        "scope_exact": true
      }
    ],
    "derived_global_assignment": {
      "action_credit_owner": 17,
      "action_token": "action:S:maintain",
      "arrow_endogenous": true,
      "binding_integrated": true,
      "boundary_closed": true,
      "c1_audit_sealed": true,
      "control_owner": 17,
      "credit_audit_sealed": true,
      "credit_source_internal": true,
      "cross_predictive_tag": "predictive:S:rank0",
      "episode_epoch": 0,
      "external_scheduler": false,
      "future_sufficient": true,
      "hidden_state_nonexposed": true,
      "interface_leak": false,
      "joint_relation_tag": "xor:S",
      "left_branch": "S:L",
      "maintenance_owner": 17,
      "object_token": "object:S",
      "order_stable": true,
      "package_owner": 17,
      "promotion_audit_sealed": true,
      "promotion_rank_after": 2,
      "promotion_rank_before": 1,
      "public_shadow": "report:stable",
      "recombination_pairs": [
        [
          "S:L",
          "S:R"
        ],
        [
          "S:R",
          "S:L"
        ]
      ],
      "recombination_relation_preserved": true,
      "record_after": 1,
      "record_before": 0,
      "repair_budget": 1,
      "repair_enabled": true,
      "repair_owner": 17,
      "right_branch": "S:R",
      "route_residue": [
        "route-root"
      ],
      "self_audit_sealed": true,
      "self_coordinate": "self:S",
      "self_model_reflexive": true,
      "strict_test_pass": true,
      "successor_total_on_viable": true,
      "temporal_owner": 17,
      "tick_phase": 0,
      "tick_progress": 1,
      "tick_viable": true,
      "viable": true
    },
    "errors": [],
    "every_clause_accepted": true,
    "every_hard_gate_passed": true,
    "every_scope_exact": true,
    "exact_clause_coverage": true,
    "failed_obligations": [],
    "forbidden_field_free": true,
    "global_constructible": true,
    "global_restricts_to_every_local": true,
    "integrated_package_valid": true,
    "join_tree": {
      "acyclic": true,
      "all_nodes_covered": true,
      "all_overlap_compatible": true,
      "connected": true,
      "edge_compatible": true,
      "edge_count_correct": true,
      "errors": [],
      "exactly_one_parent_per_nonroot": true,
      "root_declared": true,
      "running_intersection": true,
      "valid_shape": true
    },
    "model_id": "PKG-POS-03-FIACH-SOURCE",
    "supplied_global_matches": true,
    "target_owned": true,
    "temporal_substance": {
      "endogenous_arrow": true,
      "errors": [],
      "future_sufficient": true,
      "genuine_progress": true,
      "maintenance_owner_matches": true,
      "no_external_scheduler": true,
      "order_stable": true,
      "record_descends": true,
      "route_residue_retained": true,
      "successor_available": true,
      "temporal_owner_matches": true,
      "valid": true,
      "viable_tick": true
    },
    "unique_clause_slots": true
  },
  "certificate_id": "PKG-POS-03-FIACH-SOURCE",
  "checker": {
    "checked_at_phase": "CST-TT-05",
    "function": "audit_package",
    "module": "cst_tt.package_gluing",
    "python_version": "3.13.5"
  },
  "claim_ceiling": "finite structural target realization aligned to one declared handoff frontier",
  "claim_lanes": [
    "S-R"
  ],
  "handoff_alignment": {
    "alignment_fields": [
      "route_residue",
      "tick_phase",
      "record_before",
      "maintenance_owner"
    ],
    "corridor_model_ref": "models/corridors/COR-POS-01.model.json",
    "corridor_stage": 0
  },
  "model_ref": "models/packages/PKG-POS-03-FIACH-SOURCE.model.json",
  "model_sha256": "056e565af9eb151095013dd1d32607aec3a75bd16b85ce613de35a3f035ff949",
  "result_status": "checked-finite-handoff-aligned-package-certificate",
  "schema_version": "CST-TT-05",
  "theorem_evidence": {
    "lean_compile_status": "pending-toolchain",
    "lean_declarations": [
      "CSTTT.PackageTheory.acyclicLocalWitnessGluing",
      "CSTTT.PackageTheory.stagedHeterogeneousPackageAssembly"
    ],
    "theorem_ids": [
      "TTH-01",
      "TTH-02"
    ]
  }
}
